{
  "schemaRevision": 1,
  "caseId": "COURSE-VEC-P3-BOUNDARY-001",
  "profile": "P3",
  "vectorKind": "program-final-state",
  "source": {
    "corpusFile": "spec-microprograms/p3-boundaries.asm",
    "sha256": "5f1dea5fb191c1f042eb5e15f7c0cb71d1e874e4b530b28b2c7985034494f05b",
    "hashNormalization": "utf8-lf-v1"
  },
  "provenance": {
    "derivation": "hand-computed",
    "contractIds": [
      "COURSE-P3-ARITH-001",
      "COURSE-P3-ADDR-002"
    ],
    "normativeSourceIds": [
      "COURSE-SOURCE-P3-RESET-ADDR-001"
    ],
    "note": "Course arithmetic wraps at 32 bits; stock MARS trapping add is explicitly not authoritative here.",
    "vectorRevision": 1,
    "sourceRegistrySha256": "7ac3621e3b32f8e8bcdec4b6cdb04b3e13e089386872a367f396697b944b47c2"
  },
  "review": {
    "status": "candidate",
    "author": "codex-phase0-corpus",
    "reviewer": null,
    "reviewedAt": null,
    "reviewRevision": 0
  },
  "execution": {
    "verificationMode": "manual-final-state",
    "initialState": {
      "gpr": {},
      "dm": {},
      "hi": "0x00000000",
      "lo": "0x00000000",
      "cp0": {}
    },
    "stdin": null,
    "interruptSchedule": [],
    "stopCondition": {
      "kind": "halt-loop",
      "minimumHits": 2
    },
    "stepLimit": 4096
  },
  "expected": {
    "kind": "final-state",
    "haltPc": "0x00003028",
    "haltWord": "0x1000ffff",
    "gpr": {
      "8": "0x80000000",
      "9": "0x00000000",
      "10": "0x0000ffff",
      "11": "0x8000ffff",
      "12": "0xffff0001",
      "13": "0x8000ffff",
      "15": "0x00000001"
    },
    "dm": {
      "0x00002ffc": "0x8000ffff"
    },
    "writes": {
      "gpr": [
        "8",
        "9",
        "10",
        "11",
        "12",
        "13",
        "15"
      ],
      "dm": [
        "0x00002ffc"
      ]
    }
  },
  "observability": {
    "maskRevision": 1,
    "definedFields": [
      "gpr.writes",
      "dm.writes",
      "halt.pc",
      "halt.word"
    ],
    "undefinedExcluded": [
      "hi",
      "lo",
      "cp0"
    ]
  },
  "integrity": {
    "algorithm": "sha256-canonical-json-v1",
    "payloadSha256": "d59cf12d042999d2e70b02272a3b1491f0150e65ca7f3358a6a2661281f04f93"
  }
}
